<?xml version="1.0" encoding="UTF-8"?>
<!DOCTYPE fluid_balance_chart_entry SYSTEM "fluid_balance_chart_entry.dtd">
<fluid_balance_chart_entry>
<id>880e8400-e29b-41d4-a716-446655440003</id>
<created_at>2026-04-09T10:00:00Z</created_at>
<updated_at>2026-04-09T10:00:00Z</updated_at>
<deleted_at>2026-04-09T10:00:00Z</deleted_at>
<fluid_balance_chart_id>770e8400-e29b-41d4-a716-446655440002</fluid_balance_chart_id>
<entry_at>2026-04-09T10:00:00Z</entry_at>
<direction>intake</direction>
<category>oral</category>
<description>Example text.</description>
<volume_ml>0.0</volume_ml>
</fluid_balance_chart_entry>
